{
  "$schema": "https://json-schema.org/draft/2020-12/schema",
  "$comment": "Supported Plenact User Data Model versions: 1.1; references immutable 1.0 value shapes. Working definition; not yet published.",
  "$id": "urn:plenact:user-data:1.1:artwork-library",
  "type": "object",
  "properties": {
    "user_data_model_version": {
      "const": "1.1"
    },
    "payload_schema_version": {
      "const": 1
    },
    "record_type": {
      "const": "artwork_library"
    },
    "id": {
      "$ref": "urn:plenact:user-data:1.0:content-types#/$defs/uuid"
    },
    "workspace_id": {
      "$ref": "urn:plenact:user-data:1.0:content-types#/$defs/uuid"
    },
    "payload": {
      "type": "object",
      "properties": {
        "artwork_ids": {
          "type": "array",
          "items": {
            "$ref": "urn:plenact:user-data:1.0:content-types#/$defs/uuid"
          },
          "uniqueItems": true
        }
      },
      "required": [
        "artwork_ids"
      ],
      "additionalProperties": false
    }
  },
  "required": [
    "user_data_model_version",
    "payload_schema_version",
    "record_type",
    "id",
    "workspace_id",
    "payload"
  ],
  "additionalProperties": false
}
